,Title,Year,Rated,Released,Genre,Director,Writer,Actors,Plot,Country,Awards,Ratings.Value,Metascore,imdbRating,imdbVotes,imdbID,tomatoURL,Production
194,Strangers on a Train,1951,PG,30-Jun-51,"Crime, Film-Noir, Thriller",Alfred Hitchcock,"Raymond Chandler (screen play), Czenzi Ormonde (screen play), Whitfield Cook (adaptation), Patricia Highsmith (from the novel by)","Farley Granger, Ruth Roman, Robert Walker, Leo G. Carroll",A psychotic socialite confronts a pro tennis star with a theory on how two complete strangers can get away with murder - a theory that he plans to implement.,USA,Nominated for 1 Oscar. Another 2 wins & 1 nomination.,8.0/10,N/A,8,"103,963",tt0044079,http://www.rottentomatoes.com/m/strangers_on_a_train/,Warner Home Video
195,The Night of the Hunter,1955,APPROVED,24-Nov-55,"Crime, Drama, Film-Noir",Charles Laughton,"James Agee (screenplay), Davis Grubb (based on the novel by)","Robert Mitchum, Shelley Winters, Lillian Gish, James Gleason","A religious fanatic marries a gullible widow whose young children are reluctant to tell him where their real daddy hid $10,000 he'd stolen in a robbery.",USA,2 wins.,8.0/10,99,8,"68,366",tt0048424,http://www.rottentomatoes.com/m/night_of_the_hunter/,United Artists
196,All Quiet on the Western Front,1930,UNRATED,24-Aug-30,"Drama, War",Lewis Milestone,"Erich Maria Remarque (by), Maxwell Anderson (adaptation), George Abbott (screen play), Del Andrews (adaptation), C. Gardner Sullivan (supervising story chief)","Louis Wolheim, Lew Ayres, John Wray, Arnold Lucy",A young soldier faces profound disillusionment in the soul-destroying horror of World War I.,USA,Won 2 Oscars. Another 5 wins & 2 nominations.,8.1/10,N/A,8.1,"49,038",tt0020629,http://www.rottentomatoes.com/m/1000642-all_quiet_on_the_western_front/,Universal Pictures
197,Beauty and the Beast,1991,G,22-Nov-91,"Animation, Family, Fantasy","Gary Trousdale, Kirk Wise","Linda Woolverton (animation screenplay by), Brenda Chapman (story), Chris Sanders (story), Burny Mattinson (story), Kevin Harkey (story), Brian Pimental (story), Bruce Woodside (story), Joe Ranft (story), Tom Ellery (story), Kelly Asbury (story), Robert Lence (story)","Robby Benson, Jesse Corti, Rex Everhart, Angela Lansbury","A young woman whose father has been imprisoned by a terrifying beast offers herself in his place, unaware that her captor is actually a prince, physically altered by a magic spell.",USA,Won 2 Oscars. Another 24 wins & 22 nominations.,8.0/10,95,8,"336,430",tt0101414,http://www.rottentomatoes.com/m/beauty_and_the_beast_1991/,Buena Vista
198,Lion,2016,PG-13,6-Jan-17,"Biography, Drama",Garth Davis,"Saroo Brierley (adapted from the book ""A Long Way Home"" by), Luke Davies (screenplay)","Sunny Pawar, Abhishek Bharate, Priyanka Bose, Khushi Solanki","A five-year-old Indian boy gets lost on the streets of Calcutta, thousands of kilometers from home. He survives many challenges before being adopted by a couple in Australia. 25 years later, he sets out to find his lost family.","UK, Australia, USA",Nominated for 6 Oscars. Another 32 wins & 70 nominations.,8.1/10,69,8.1,"113,296",tt3741834,https://www.rottentomatoes.com/m/lion_2016,See-Saw Films
199,Twelve Monkeys,1995,R,5-Jan-96,"Mystery, Sci-Fi, Thriller",Terry Gilliam,"Chris Marker (film La Jetée), David Webb Peoples (screenplay), Janet Peoples (screenplay)","Joseph Melito, Bruce Willis, Jon Seda, Michael Chance","In a future world devastated by disease, a convict is sent back in time to gather information about the man-made virus that wiped out most of the human population on the planet.",USA,Nominated for 2 Oscars. Another 9 wins & 18 nominations.,8.0/10,74,8,"492,644",tt0114746,http://www.rottentomatoes.com/m/12_monkeys/,Universal Pictures
200,Guardians of the Galaxy,2014,PG-13,1-Aug-14,"Action, Adventure, Sci-Fi",James Gunn,"James Gunn, Nicole Perlman, Dan Abnett (based on the Marvel comics by), Andy Lanning (based on the Marvel comics by), Bill Mantlo (character created by: Rocket Raccoon), Keith Giffen (character created by: Rocket Raccoon), Jim Starlin (characters created by: Drax the Destroyer,  Gamora,  Thanos), Steve Englehart (character created by: Star-Lord), Steve Gan (character created by: Star-Lord), Steve Gerber (character created by: Howard the Duck), Val Mayerik (character created by: Howard the Duck)","Chris Pratt, Zoe Saldana, Dave Bautista, Vin Diesel",A group of intergalactic criminals are forced to work together to stop a fanatical warrior from taking control of the universe.,"USA, UK",Nominated for 2 Oscars. Another 50 wins & 96 nominations.,8.1/10,76,8.1,"768,444",tt2015381,http://www.rottentomatoes.com/m/guardians_of_the_galaxy/,Walt Disney Pictures
201,Dog Day Afternoon,1975,R,25-Dec-75,"Biography, Crime, Drama",Sidney Lumet,"Frank Pierson (screenplay), P.F. Kluge (based upon a magazine article by), Thomas Moore (based upon a magazine article by)","Penelope Allen, Sully Boyar, John Cazale, Beulah Garrick",A man robs a bank to pay for his lover's operation; it turns into a hostage situation and a media circus.,USA,Won 1 Oscar. Another 13 wins & 19 nominations.,8.0/10,N/A,8,"194,970",tt0072890,http://www.rottentomatoes.com/m/dog_day_afternoon/,WARNER BROTHERS PICTURES
202,Jaws,1975,PG,20-Jun-75,"Adventure, Drama, Thriller",Steven Spielberg,"Peter Benchley (screenplay), Carl Gottlieb (screenplay), Peter Benchley (based on the novel by)","Roy Scheider, Robert Shaw, Richard Dreyfuss, Lorraine Gary","A giant great white shark arrives on the shores of a New England beach resort and wreaks havoc with bloody attacks on swimmers, until a local sheriff teams up with a marine biologist and an old seafarer to hunt the monster down.",USA,Won 3 Oscars. Another 10 wins & 17 nominations.,8.0/10,86,8,"445,407",tt0073195,http://www.rottentomatoes.com/m/jaws/,Universal Pictures
203,Zootopia,2016,PG,4-Mar-16,"Animation, Adventure, Comedy","Jared Bush, Byron Howard, Rich Moore","Byron Howard (story by), Rich Moore (story by), Jared Bush (story by), Jim Reardon (story by), Josie Trinidad (story by), Phil Johnston (story by), Jennifer Lee (story by), Jared Bush (screenplay), Phil Johnston (screenplay)","Ginnifer Goodwin, Jason Bateman, Idris Elba, Jenny Slate","In a city of anthropomorphic animals, a rookie bunny cop and a cynical con artist fox must work together to uncover a conspiracy.",USA,Won 1 Oscar. Another 36 wins & 58 nominations.,8.1/10,78,8.1,"304,299",tt2948356,http://www.rottentomatoes.com/m/zootopia/,Walt Disney Animation Studios
204,Guardians of the Galaxy Vol. 2,2017,PG-13,5-May-17,"Action, Adventure, Sci-Fi",James Gunn,"James Gunn, Dan Abnett (based on the Marvel comics by), Andy Lanning (based on the Marvel comics by), Steve Englehart (Star-lord created by), Steve Gan (Star-lord created by), Jim Starlin (Gamora and Drax created by), Stan Lee (Groot created by), Larry Lieber (Groot created by), Jack Kirby (Groot created by), Bill Mantlo (Rocket Raccoon created by), Keith Giffen (Rocket Raccoon created by), Steve Gerber (character created by: Howard the Duck), Val Mayerik (character created by: Howard the Duck)","Chris Pratt, Zoe Saldana, Dave Bautista, Vin Diesel",The Guardians must fight to keep their newfound family together as they unravel the mystery of Peter Quill's true parentage.,USA,N/A,8.1/10,67,8.1,"175,272",tt3896198,http://www.rottentomatoes.com/m/guardians_of_the_galaxy_vol_2/,Walt Disney Pictures
205,Pirates of the Caribbean: The Curse of the Black Pearl,2003,PG-13,9-Jul-03,"Action, Adventure, Fantasy",Gore Verbinski,"Ted Elliott (screen story), Terry Rossio (screen story), Stuart Beattie (screen story), Jay Wolpert (screen story), Ted Elliott (screenplay), Terry Rossio (screenplay)","Johnny Depp, Geoffrey Rush, Orlando Bloom, Keira Knightley","Blacksmith Will Turner teams up with eccentric pirate ""Captain"" Jack Sparrow to save his love, the governor's daughter, from Jack's former pirate allies, who are now undead.",USA,Nominated for 5 Oscars. Another 36 wins & 96 nominations.,8.0/10,63,8,"869,710",tt0325980,http://www.rottentomatoes.com/m/pirates_of_the_caribbean_the_curse_of_the_black_pearl/,Buena Vista Pictures
206,Before Sunset,2004,R,30-Jul-04,"Drama, Romance",Richard Linklater,"Richard Linklater (screenplay), Julie Delpy (screenplay), Ethan Hawke (screenplay), Richard Linklater (story), Kim Krizan (story), Richard Linklater (characters), Kim Krizan (characters)","Ethan Hawke, Julie Delpy, Vernon Dobtcheff, Louise Lemoine Torrès","Nine years after Jesse and Celine first met, they encounter each other again on the French leg of Jesse's book tour.",USA,Nominated for 1 Oscar. Another 9 wins & 29 nominations.,8.0/10,90,8,"179,650",tt0381681,http://www.rottentomatoes.com/m/before_sunset/,Warner Independent Pictures
207,The Imitation Game,2014,PG-13,25-Dec-14,"Biography, Drama, Thriller",Morten Tyldum,"Graham Moore, Andrew Hodges (book)","Benedict Cumberbatch, Keira Knightley, Matthew Goode, Rory Kinnear","During World War II, mathematician Alan Turing tries to crack the enigma code with help from fellow mathematicians.","UK, USA",Won 1 Oscar. Another 44 wins & 150 nominations.,8.1/10,73,8.1,"535,118",tt2084970,http://www.rottentomatoes.com/m/the_imitation_game/,The Weinstein Company
208,Young Frankenstein,1974,PG,15-Dec-74,Comedy,Mel Brooks,"Gene Wilder (screen story and screenplay), Mel Brooks (screen story and screenplay), Mary Shelley (based on characters in the novel ""Frankenstein"" by)","Gene Wilder, Peter Boyle, Marty Feldman, Madeline Kahn","An American grandson of the infamous scientist, struggling to prove that he is not as insane as people believe, is invited to Transylvania, where he discovers the process that reanimates a dead body.",USA,Nominated for 2 Oscars. Another 11 wins & 5 nominations.,8.0/10,80,8,"121,147",tt0072431,http://www.rottentomatoes.com/m/young_frankenstein/,20th Century Fox
209,Stalag 17,1953,NOT RATED,10-Aug-53,"Drama, War",Billy Wilder,"Billy Wilder (written for the screen by), Edwin Blum (written for the screen by), Donald Bevan (based on the play by), Edmund Trzcinski (based on the play by)","William Holden, Don Taylor, Otto Preminger, Robert Strauss","When two escaping American World War II prisoners are killed, the German POW camp barracks black marketeer, J.J. Sefton, is suspected of being an informer.",USA,Won 1 Oscar. Another 1 win & 5 nominations.,8.0/10,N/A,8,"44,802",tt0046359,http://www.rottentomatoes.com/m/stalag_17/,Paramount Home Video
210,Dogville,2003,R,23-Apr-04,"Crime, Drama",Lars von Trier,Lars von Trier,"Nicole Kidman, Harriet Andersson, Lauren Bacall, Jean-Marc Barr","A woman on the run from the mob is reluctantly accepted in a small Colorado town. In exchange, she agrees to work for them. As a search visits town, she finds out that their support has a price. Yet her dangerous secret is never far away...","Netherlands, Denmark, UK, France, Finland, Sweden, Germany, Italy, Norway",20 wins & 30 nominations.,8.0/10,60,8,"113,851",tt0276919,http://www.rottentomatoes.com/m/dogville/,Lions Gate Films
211,Dead Poets Society,1989,PG,9-Jun-89,"Comedy, Drama",Peter Weir,Tom Schulman,"Robin Williams, Robert Sean Leonard, Ethan Hawke, Josh Charles",English teacher John Keating inspires his students to look at poetry with a different perspective of authentic knowledge and feelings.,USA,Won 1 Oscar. Another 18 wins & 19 nominations.,8.0/10,79,8,"295,852",tt0097165,http://www.rottentomatoes.com/m/dead_poets_society/,Buena Vista Pictures
212,High Noon,1952,PG,30-Jul-52,"Drama, Thriller, Western",Fred Zinnemann,"Carl Foreman (screenplay), John W. Cunningham (magazine story ""The Tin Star"")","Gary Cooper, Thomas Mitchell, Lloyd Bridges, Katy Jurado","Marshal Will Kane, personally compelled to face his returning deadly enemy Frank Miller, finds that his fellow townspeople refuse to help him.",USA,Won 4 Oscars. Another 13 wins & 10 nominations.,8.0/10,89,8,"83,393",tt0044706,http://www.rottentomatoes.com/m/1046060-high_noon/,United Artists
213,Papillon,1973,R,6-Feb-74,"Biography, Crime, Drama",Franklin J. Schaffner,"Dalton Trumbo (screenplay), Lorenzo Semple Jr. (screenplay), Henri Charrière (book)","Steve McQueen, Dustin Hoffman, Victor Jory, Don Gordon","A man befriends a fellow criminal as the two of them begin serving their sentence on a dreadful prison island, which inspires the man to plot his escape.","France, USA",Nominated for 1 Oscar. Another 2 wins & 1 nomination.,8.0/10,N/A,8,"101,553",tt0070511,http://www.rottentomatoes.com/m/papillon/,Twentieth Century Fox Home Entertainment
214,A Streetcar Named Desire,1951,PG,1-Dec-51,Drama,Elia Kazan,"Tennessee Williams (screen play), Oscar Saul (adaptation), Tennessee Williams (original play ""A Streetcar Named Desire"")","Vivien Leigh, Marlon Brando, Kim Hunter, Karl Malden",Disturbed Blanche DuBois moves in with her sister in New Orleans and is tormented by her brutish brother-in-law while her reality crumbles around her.,USA,Won 4 Oscars. Another 13 wins & 15 nominations.,8.0/10,N/A,8,"82,622",tt0044081,http://www.rottentomatoes.com/m/1020333-streetcar_named_desire/,Warner Bros. Pictures
215,Arsenic and Old Lace,1944,NOT RATED,23-Sep-44,"Comedy, Crime, Thriller",Frank Capra,"Julius J. Epstein (screen play), Philip G. Epstein (screen play), Joseph Kesselring (play)","Cary Grant, Priscilla Lane, Raymond Massey, Jack Carson","A drama critic learns on his wedding day that his beloved maiden aunts are homicidal maniacs, and that insanity runs in his family.",USA,1 nomination.,8.0/10,N/A,8,"56,783",tt0036613,http://www.rottentomatoes.com/m/arsenic_and_old_lace/,Warner Bros. Pictures
216,Sin City,2005,R,1-Apr-05,"Crime, Thriller","Frank Miller, Robert Rodriguez, Quentin Tarantino",Frank Miller (graphic novels),"Jessica Alba, Devon Aoki, Alexis Bledel, Powers Boothe","A film that explores the dark and miserable town, Basin City, and tells the story of three different people, all caught up in violent corruption.",USA,33 wins & 51 nominations.,8.0/10,74,8,"685,825",tt0401792,http://www.rottentomatoes.com/m/sin_city/,Dimension Films
217,The Hustler,1961,UNRATED,27-Oct-61,"Drama, Sport",Robert Rossen,"Sidney Carroll (screenplay), Robert Rossen (screenplay), Walter Tevis (based on the novel by)","Paul Newman, Jackie Gleason, Piper Laurie, George C. Scott",An up-and-coming pool player plays a long-time champion in a single high-stakes match.,USA,Won 2 Oscars. Another 11 wins & 20 nominations.,8.0/10,N/A,8,"65,649",tt0054997,http://www.rottentomatoes.com/m/hustler/,Fox
218,A Night at the Opera,1935,PASSED,15-Nov-35,"Comedy, Music, Musical","Sam Wood, Edmund Goulding","George S. Kaufman (screen play), Morrie Ryskind (screen play), James Kevin McGuinness (from a story by)","Groucho Marx, Chico Marx, Harpo Marx, Kitty Carlisle",A sly business manager and two wacky friends of two opera singers help them achieve success while humiliating their stuffy and snobbish enemies.,USA,1 win.,8.1/10,N/A,8.1,"26,025",tt0026778,http://www.rottentomatoes.com/m/1015002-night_at_the_opera/,MGM
219,The Killing,1956,APPROVED,6-Jun-56,"Crime, Drama, Film-Noir",Stanley Kubrick,"Stanley Kubrick (screenplay), Jim Thompson (dialogue), Lionel White (novel)","Sterling Hayden, Coleen Gray, Vince Edwards, Jay C. Flippen",Crooks plan and execute a daring race-track robbery.,USA,N/A,8.0/10,N/A,8,"65,940",tt0049406,http://www.rottentomatoes.com/m/killing/,United Artists
220,The Avengers,2012,PG-13,4-May-12,"Action, Sci-Fi",Joss Whedon,"Joss Whedon (screenplay), Zak Penn (story), Joss Whedon (story)","Robert Downey Jr., Chris Evans, Mark Ruffalo, Chris Hemsworth",Earth's mightiest heroes must come together and learn to fight as a team if they are to stop the mischievous Loki and his alien army from enslaving humanity.,USA,Nominated for 1 Oscar. Another 37 wins & 79 nominations.,8.1/10,69,8.1,"1,051,143",tt0848228,http://www.rottentomatoes.com/m/marvels_the_avengers/,Walt Disney Pictures
221,Notorious,1946,APPROVED,6-Sep-46,"Drama, Film-Noir, Romance",Alfred Hitchcock,Ben Hecht,"Cary Grant, Ingrid Bergman, Claude Rains, Louis Calhern",A woman is asked to spy on a group of Nazi friends in South America. How far will she have to go to ingratiate herself with them?,USA,Nominated for 2 Oscars. Another 3 wins & 1 nomination.,8.0/10,N/A,8,"77,339",tt0038787,http://www.rottentomatoes.com/m/1015287-notorious/,RKO Radio Pictures
222,Harvey,1950,NOT RATED,21-Dec-50,"Comedy, Drama, Fantasy",Henry Koster,"Mary Chase (from the Pulitzer Prize Play by), Mary Chase (screenplay), Oscar Brodney (screenplay)","Wallace Ford, William H. Lynn, Victoria Horne, Jesse White","Due to his insistence that he has an invisible six foot-tall rabbit for a best friend, a whimsical middle-aged man is thought by his family to be insane - but he may be wiser than anyone knows.",USA,Won 1 Oscar. Another 1 win & 4 nominations.,8.0/10,N/A,8,"46,446",tt0042546,http://www.rottentomatoes.com/m/1009261-harvey/,MCA Universal Home Video
223,The Martian,2015,PG-13,2-Oct-15,"Adventure, Drama, Sci-Fi",Ridley Scott,"Drew Goddard (screenplay), Andy Weir (based on the novel by)","Matt Damon, Jessica Chastain, Kristen Wiig, Jeff Daniels","An astronaut becomes stranded on Mars after his team assume him dead, and must rely on his ingenuity to find a way to signal to Earth that he is alive.","USA, UK",Nominated for 7 Oscars. Another 34 wins & 180 nominations.,8.0/10,80,8,"560,864",tt3659388,http://www.rottentomatoes.com/m/the_martian/,20th Century Fox
224,The Exorcist,1973,R,26-Dec-73,Horror,William Friedkin,"William Peter Blatty (written for the screen by), William Peter Blatty (novel)","Ellen Burstyn, Max von Sydow, Lee J. Cobb, Kitty Winn","When a teenage girl is possessed by a mysterious entity, her mother seeks the help of two priests to save her daughter.",USA,Won 2 Oscars. Another 14 wins & 15 nominations.,8.0/10,82,8,"299,364",tt0070047,http://www.rottentomatoes.com/m/exorcist/,Warner Bros. Pictures
225,Rio Bravo,1959,NOT RATED,4-Apr-59,"Action, Drama, Western",Howard Hawks,"Jules Furthman (screenplay), Leigh Brackett (screenplay), B.H. McCampbell (short story)","John Wayne, Dean Martin, Ricky Nelson, Angie Dickinson","A small-town sheriff in the American West enlists the help of a cripple, a drunk, and a young gunfighter in his efforts to hold in jail the brother of the local bad guy.",USA,Won 1 Golden Globe. Another 1 win & 4 nominations.,8.0/10,N/A,8,"45,629",tt0053221,http://www.rottentomatoes.com/m/rio_bravo/,Xenon
226,The Philadelphia Story,1940,NOT RATED,17-Jan-41,"Comedy, Romance",George Cukor,"Donald Ogden Stewart (screen play), Philip Barry (based on the play by)","Cary Grant, Katharine Hepburn, James Stewart, Ruth Hussey","When a rich woman's ex-husband and a tabloid-type reporter turn up just before her planned remarriage, she begins to learn the truth about herself.",USA,Won 2 Oscars. Another 3 wins & 5 nominations.,8.0/10,N/A,8,"52,602",tt0032904,http://www.rottentomatoes.com/m/philadelphia_story/,MGM
227,Rope,1948,APPROVED,25-Sep-48,"Crime, Drama, Thriller",Alfred Hitchcock,"Hume Cronyn (adapted by), Patrick Hamilton (from the play by), Arthur Laurents (screenplay)","John Dall, Farley Granger, Edith Evanson, Douglas Dick","Two young men strangle their ""inferior"" classmate, hide his body in their apartment, and invite his friends and family to a dinner party as a means to challenge the ""perfection"" of their crime.",USA,3 nominations.,8.0/10,N/A,8,"102,340",tt0040746,http://www.rottentomatoes.com/m/rope/,Warner Bros. Pictures
228,The Big Sleep,1946,APPROVED,31-Aug-46,"Crime, Film-Noir, Mystery",Howard Hawks,"William Faulkner (screen play), Leigh Brackett (screen play), Jules Furthman (screen play), Raymond Chandler (from the novel by)","Humphrey Bogart, Lauren Bacall, John Ridgely, Martha Vickers","Private detective Philip Marlowe is hired by a rich family. Before the complex case is over, he's seen murder, blackmail, and what might be love.",USA,2 wins.,8.0/10,N/A,8,"67,315",tt0038355,http://www.rottentomatoes.com/m/1002352-big_sleep/,Warner Bros. Pictures
229,Pink Floyd: The Wall,1982,R,17-Sep-82,"Animation, Drama, Fantasy",Alan Parker,"Roger Waters (album ""The Wall""), Roger Waters (screenplay)","Bob Geldof, Christine Hargreaves, James Laurenson, Eleanor David",A confined but troubled rock star descends into madness in the midst of his physical and social isolation from everyone.,UK,Won 2 BAFTA Film Awards. Another 1 win & 1 nomination.,8.0/10,N/A,8,"63,190",tt0084503,http://www.rottentomatoes.com/m/pink_floyd_the_wall/,United Artists
230,The King's Speech,2010,R,25-Dec-10,"Biography, Drama",Tom Hooper,David Seidler (screenplay),"Colin Firth, Helena Bonham Carter, Derek Jacobi, Robert Portal","The story of King George VI of the United Kingdom of Great Britain and Northern Ireland, his impromptu ascension to the throne and the speech therapist who helped the unsure monarch become worthy of it.","UK, USA, Australia",Won 4 Oscars. Another 103 wins & 194 nominations.,8.0/10,88,8,"537,662",tt1504320,http://www.rottentomatoes.com/m/the_kings_speech/,The Weinstein Company
231,A Christmas Story,1983,PG,18-Nov-83,"Comedy, Family",Bob Clark,"Jean Shepherd (based on the novel ""In God We Trust,  All Others Pay Cash"" by), Jean Shepherd (screenplay), Leigh Brown (screenplay), Bob Clark (screenplay)","Melinda Dillon, Darren McGavin, Peter Billingsley, Scott Schwartz","In the 1940s, a young boy named Ralphie attempts to convince his parents, his teacher, and Santa that a Red Ryder B.B. gun really is the perfect Christmas gift.","USA, Canada",3 wins & 11 nominations.,8.0/10,77,8,"110,893",tt0085334,http://www.rottentomatoes.com/m/1004151-christmas_story/,MGM
232,The Graduate,1967,APPROVED,22-Dec-67,"Comedy, Drama",Mike Nichols,"Calder Willingham (screenplay), Buck Henry (screenplay), Charles Webb (based on the novel by)","Anne Bancroft, Dustin Hoffman, Katharine Ross, William Daniels",A disillusioned college graduate finds himself torn between his older lover and her daughter.,USA,Won 1 Oscar. Another 20 wins & 16 nominations.,8.0/10,77,8,"220,459",tt0061722,http://www.rottentomatoes.com/m/graduate/,Embassy Pictures/Rialto Pictures
233,JFK,1991,R,20-Dec-91,"Drama, History, Thriller",Oliver Stone,"Oliver Stone (screenplay), Zachary Sklar (screenplay), Jim Garrison (book), Jim Marrs (book)","Sally Kirkland, Anthony Ramirez, Ray LePere, Steve Reed",A New Orleans DA discovers there's more to the Kennedy assassination than the official story.,"France, USA",Won 2 Oscars. Another 17 wins & 25 nominations.,8.0/10,72,8,"120,061",tt0102138,http://www.rottentomatoes.com/m/1037756-jfk/,Warner Bros.
234,Sling Blade,1996,R,14-Mar-97,Drama,Billy Bob Thornton,"Billy Bob Thornton (play), Billy Bob Thornton (screenplay)","Billy Bob Thornton, Dwight Yoakam, J.T. Walsh, John Ritter","Karl Childers, a simple man hospitalized since his childhood murder of his mother and her lover, is released to start a new life in a small town.",USA,Won 1 Oscar. Another 13 wins & 15 nominations.,8.0/10,84,8,"75,931",tt0117666,http://www.rottentomatoes.com/m/sling_blade/,Miramax Films
235,Blood Diamond,2006,R,8-Dec-06,"Adventure, Drama, Thriller",Edward Zwick,"Charles Leavitt (screenplay), Charles Leavitt (story), C. Gaby Mitchell (story)","Leonardo DiCaprio, Djimon Hounsou, Jennifer Connelly, Kagiso Kuypers","A fisherman, a smuggler, and a syndicate of businessmen match wits over the possession of a priceless diamond.","Germany, USA",Nominated for 5 Oscars. Another 8 wins & 26 nominations.,8.0/10,64,8,"424,781",tt0450259,http://www.rottentomatoes.com/m/blood_diamond/,Warner Bros. Pictures
236,Magnolia,1999,R,7-Jan-00,Drama,Paul Thomas Anderson,Paul Thomas Anderson,"Pat Healy, Genevieve Zweig, Mark Flanagan, Neil Flynn","An epic mosaic of interrelated characters in search of love, forgiveness, and meaning in the San Fernando Valley.",USA,Nominated for 3 Oscars. Another 28 wins & 51 nominations.,8.0/10,77,8,"251,286",tt0175880,http://www.rottentomatoes.com/m/magnolia/,New Line Cinema
237,Rain Man,1988,R,16-Dec-88,Drama,Barry Levinson,"Barry Morrow (story), Ronald Bass (screenplay), Barry Morrow (screenplay)","Dustin Hoffman, Tom Cruise, Valeria Golino, Gerald R. Molen",Selfish yuppie Charlie Babbitt's father left a fortune to his savant brother Raymond and a pittance to Charlie; they travel cross-country.,USA,Won 4 Oscars. Another 22 wins & 22 nominations.,8.0/10,65,8,"403,104",tt0095953,http://www.rottentomatoes.com/m/rain_man/,MGM
238,The Revenant,2015,R,8-Jan-16,"Adventure, Drama, Thriller",Alejandro González Iñárritu,"Mark L. Smith (screenplay), Alejandro González Iñárritu (screenplay), Michael Punke (based in part on the novel by)","Leonardo DiCaprio, Tom Hardy, Domhnall Gleeson, Will Poulter",A frontiersman on a fur trading expedition in the 1820s fights for survival after being mauled by a bear and left for dead by members of his own hunting team.,"Hong Kong, Taiwan, USA",Won 3 Oscars. Another 82 wins & 177 nominations.,8.0/10,76,8,"504,647",tt1663202,http://www.rottentomatoes.com/m/the_revenant_2015/,20th Century Fox
239,The Nightmare Before Christmas,1993,PG,29-Oct-93,"Animation, Family, Fantasy",Henry Selick,"Tim Burton (based on: a story and characters by), Michael McDowell (adaptation), Caroline Thompson (screenplay)","Danny Elfman, Chris Sarandon, Catherine O'Hara, William Hickey","Jack Skellington, king of Halloween Town, discovers Christmas Town, but his attempts to bring Christmas to his home cause confusion.",USA,Nominated for 1 Oscar. Another 7 wins & 7 nominations.,8.0/10,N/A,8,"238,561",tt0107688,http://www.rottentomatoes.com/m/nightmare_before_christmas/,Touchstone Pictures
